{
  "schemaVersion": 1,
  "releaseId": "identity-ui-development-8",
  "presentationSchemaVersions": [1],
  "catalogRootPins": [
    {
      "keyId": "catalog-root-dev-1",
      "publicJwk": {
        "kty": "EC",
        "crv": "P-256",
        "x": "HhhTL9R1TALzBB2cdc6zO4P_2BrHzk_ogsyxyYvFiW4",
        "y": "pGwxHE4v9A3ZajZT5uRURdMt_khuztdcepDGoYiBwKM"
      },
      "notBefore": "2026-09-01T00:00:00Z",
      "issueUntil": "2030-01-01T00:00:00Z",
      "verifyUntil": "2036-01-01T00:00:00Z",
      "emergencyDenied": false
    }
  ],
  "supportedLocales": ["en"],
  "themePairings": [
    {
      "themePairingId": "octamorph-iris",
      "systemId": "octamorph",
      "paletteId": "iris",
      "modePolicy": "system",
      "systemSpecPath": "src/presentations/themes/octamorph.system.v1.json",
      "systemSpecDigest": "PbjN0KC8VcSoAJ1aOB4h-aM-0bHhF45TKcfLPYS1mDY",
      "paletteSpecPath": "src/presentations/themes/iris.palette.v1.json",
      "paletteSpecDigest": "IwmGegT4PLM1heTqDRTFDt8Qg6qWNYy2VpZSaPoCKag"
    },
    {
      "themePairingId": "shadcn-neutral",
      "systemId": "shadcn",
      "paletteId": "neutral",
      "modePolicy": "system",
      "systemSpecPath": "src/presentations/themes/shadcn.system.v1.json",
      "systemSpecDigest": "NmouZ8a-uIb_yl4vDEs8dumghb07hUnoB-2xkquh2vI",
      "paletteSpecPath": "src/presentations/themes/neutral.palette.v1.json",
      "paletteSpecDigest": "WYUD0mzCyHrlOKoltYwPQYu7321TdvVEK_25pMpZQOM"
    }
  ],
  "assets": [
    {
      "assetId": "catalog-test-mark-v1",
      "relativePath": "public/auth-assets/catalog-test-mark.v1.svg",
      "mediaType": "imageSvgXml",
      "sha256": "YqN2fWBWbo9lj7Tg3TlP8PqAWeNmk_P3qga74nJW9E8",
      "sizeBytes": 314,
      "width": 64,
      "height": 64,
      "admission": "reviewedImmutable"
    },
    {
      "assetId": "octamorph-mark-v1",
      "relativePath": "public/auth-assets/octamorph-mark.v1.svg",
      "mediaType": "imageSvgXml",
      "sha256": "oO2QYgvWfZrLqg3mUPsYpglUa4OXpExxi7fhwUJXTGg",
      "sizeBytes": 215876,
      "width": 226,
      "height": 224,
      "admission": "reviewedImmutable"
    },
    {
      "assetId": "octamorph-auth-account-v1",
      "relativePath": "public/auth-assets/octamorph-auth-account.v1.webp",
      "mediaType": "imageWebp",
      "sha256": "TnBLAUz1g45Bh560tP-l0fFNuqZglhfV2xTHm0_P3Ic",
      "sizeBytes": 72896,
      "width": 720,
      "height": 824,
      "admission": "reviewedImmutable"
    }
  ],
  "localeMessageKeys": {
    "en": ["auth.product.catalog-test", "auth.product.octamorph", "region.local-a", "region.local-b"]
  },
  "localeBundles": {
    "en": {
      "relativePath": "src/i18n/locales/en/catalog.json",
      "sha256": "HFTexBbfwsfnOeAjsFB6OzJN1yHwBX79bmnFpOsDtPM"
    }
  },
  "presentations": [
    {
      "schemaVersion": 1,
      "presentationId": "catalog-test",
      "presentationVersion": "central-development-6",
      "productNameMessageKey": "auth.product.catalog-test",
      "logoAssets": {"kind": "modeSafe", "assetId": "catalog-test-mark-v1"},
      "artworkAssetId": null,
      "themePairingId": "shadcn-neutral",
      "layout": "centeredCard"
    },
    {
      "schemaVersion": 1,
      "presentationId": "octamorph",
      "presentationVersion": "central-development-6",
      "productNameMessageKey": "auth.product.octamorph",
      "logoAssets": {"kind": "modeSafe", "assetId": "octamorph-mark-v1"},
      "artworkAssetId": "octamorph-auth-account-v1",
      "themePairingId": "octamorph-iris",
      "layout": "splitArtwork"
    }
  ],
  "executableAssetCount": 1,
  "serviceWorkerAssetCount": 0,
  "scriptSha256": ["sha256-P50hVfHQuMziYK7QXrlsRakv2EsHRmGI5Bw/o6CuZdo="],
  "styleSha256": []
}
